GEO.id,GEO.id2,GEO.display-label,B16004_001E,B16004_001M,B16004_002E,B16004_002M,B16004_003E,B16004_003M,B16004_004E,B16004_004M,B16004_005E,B16004_005M,B16004_006E,B16004_006M,B16004_007E,B16004_007M,B16004_008E,B16004_008M,B16004_009E,B16004_009M,B16004_010E,B16004_010M,B16004_011E,B16004_011M,B16004_012E,B16004_012M,B16004_013E,B16004_013M,B16004_014E,B16004_014M,B16004_015E,B16004_015M,B16004_016E,B16004_016M,B16004_017E,B16004_017M,B16004_018E,B16004_018M,B16004_019E,B16004_019M,B16004_020E,B16004_020M,B16004_021E,B16004_021M,B16004_022E,B16004_022M,B16004_023E,B16004_023M,B16004_024E,B16004_024M,B16004_025E,B16004_025M,B16004_026E,B16004_026M,B16004_027E,B16004_027M,B16004_028E,B16004_028M,B16004_029E,B16004_029M,B16004_030E,B16004_030M,B16004_031E,B16004_031M,B16004_032E,B16004_032M,B16004_033E,B16004_033M,B16004_034E,B16004_034M,B16004_035E,B16004_035M,B16004_036E,B16004_036M,B16004_037E,B16004_037M,B16004_038E,B16004_038M,B16004_039E,B16004_039M,B16004_040E,B16004_040M,B16004_041E,B16004_041M,B16004_042E,B16004_042M,B16004_043E,B16004_043M,B16004_044E,B16004_044M,B16004_045E,B16004_045M,B16004_046E,B16004_046M,B16004_047E,B16004_047M,B16004_048E,B16004_048M,B16004_049E,B16004_049M,B16004_050E,B16004_050M,B16004_051E,B16004_051M,B16004_052E,B16004_052M,B16004_053E,B16004_053M,B16004_054E,B16004_054M,B16004_055E,B16004_055M,B16004_056E,B16004_056M,B16004_057E,B16004_057M,B16004_058E,B16004_058M,B16004_059E,B16004_059M,B16004_060E,B16004_060M,B16004_061E,B16004_061M,B16004_062E,B16004_062M,B16004_063E,B16004_063M,B16004_064E,B16004_064M,B16004_065E,B16004_065M,B16004_066E,B16004_066M,B16004_067E,B16004_067M
Id,Id2,Geography,Estimate!!Total,Margin of Error!!Total,Estimate!!Total!!5 to 17 years,Margin of Error!!Total!!5 to 17 years,Estimate!!Total!!5 to 17 years!!Speak only English,Margin of Error!!Total!!5 to 17 years!!Speak only English,Estimate!!Total!!5 to 17 years!!Speak Spanish,Margin of Error!!Total!!5 to 17 years!!Speak Spanish,"Estimate!!Total!!5 to 17 years!!Speak Spanish!!Speak English very well""""","Margin of Error!!Total!!5 to 17 years!!Speak Spanish!!Speak English very well""""","Estimate!!Total!!5 to 17 years!!Speak Spanish!!Speak English well""""","Margin of Error!!Total!!5 to 17 years!!Speak Spanish!!Speak English well""""","Estimate!!Total!!5 to 17 years!!Speak Spanish!!Speak English not well""""","Margin of Error!!Total!!5 to 17 years!!Speak Spanish!!Speak English not well""""","Estimate!!Total!!5 to 17 years!!Speak Spanish!!Speak English not at all""""","Margin of Error!!Total!!5 to 17 years!!Speak Spanish!!Speak English not at all""""",Estimate!!Total!!5 to 17 years!!Speak other Indo-European languages,Margin of Error!!Total!!5 to 17 years!!Speak other Indo-European languages,"Estimate!!Total!!5 to 17 years!!Speak other Indo-European languages!!Speak English very well""""","Margin of Error!!Total!!5 to 17 years!!Speak other Indo-European languages!!Speak English very well""""","Estimate!!Total!!5 to 17 years!!Speak other Indo-European languages!!Speak English well""""","Margin of Error!!Total!!5 to 17 years!!Speak other Indo-European languages!!Speak English well""""","Estimate!!Total!!5 to 17 years!!Speak other Indo-European languages!!Speak English not well""""","Margin of Error!!Total!!5 to 17 years!!Speak other Indo-European languages!!Speak English not well""""","Estimate!!Total!!5 to 17 years!!Speak other Indo-European languages!!Speak English not at all""""","Margin of Error!!Total!!5 to 17 years!!Speak other Indo-European languages!!Speak English not at all""""",Estimate!!Total!!5 to 17 years!!Speak Asian and Pacific Island languages,Margin of Error!!Total!!5 to 17 years!!Speak Asian and Pacific Island languages,"Estimate!!Total!!5 to 17 years!!Speak Asian and Pacific Island languages!!Speak English very well""""","Margin of Error!!Total!!5 to 17 years!!Speak Asian and Pacific Island languages!!Speak English very well""""","Estimate!!Total!!5 to 17 years!!Speak Asian and Pacific Island languages!!Speak English well""""","Margin of Error!!Total!!5 to 17 years!!Speak Asian and Pacific Island languages!!Speak English well""""","Estimate!!Total!!5 to 17 years!!Speak Asian and Pacific Island languages!!Speak English not well""""","Margin of Error!!Total!!5 to 17 years!!Speak Asian and Pacific Island languages!!Speak English not well""""","Estimate!!Total!!5 to 17 years!!Speak Asian and Pacific Island languages!!Speak English not at all""""","Margin of Error!!Total!!5 to 17 years!!Speak Asian and Pacific Island languages!!Speak English not at all""""",Estimate!!Total!!5 to 17 years!!Speak other languages,Margin of Error!!Total!!5 to 17 years!!Speak other languages,"Estimate!!Total!!5 to 17 years!!Speak other languages!!Speak English very well""""","Margin of Error!!Total!!5 to 17 years!!Speak other languages!!Speak English very well""""","Estimate!!Total!!5 to 17 years!!Speak other languages!!Speak English well""""","Margin of Error!!Total!!5 to 17 years!!Speak other languages!!Speak English well""""","Estimate!!Total!!5 to 17 years!!Speak other languages!!Speak English not well""""","Margin of Error!!Total!!5 to 17 years!!Speak other languages!!Speak English not well""""","Estimate!!Total!!5 to 17 years!!Speak other languages!!Speak English not at all""""","Margin of Error!!Total!!5 to 17 years!!Speak other languages!!Speak English not at all""""",Estimate!!Total!!18 to 64 years,Margin of Error!!Total!!18 to 64 years,Estimate!!Total!!18 to 64 years!!Speak only English,Margin of Error!!Total!!18 to 64 years!!Speak only English,Estimate!!Total!!18 to 64 years!!Speak Spanish,Margin of Error!!Total!!18 to 64 years!!Speak Spanish,"Estimate!!Total!!18 to 64 years!!Speak Spanish!!Speak English very well""""","Margin of Error!!Total!!18 to 64 years!!Speak Spanish!!Speak English very well""""","Estimate!!Total!!18 to 64 years!!Speak Spanish!!Speak English well""""","Margin of Error!!Total!!18 to 64 years!!Speak Spanish!!Speak English well""""","Estimate!!Total!!18 to 64 years!!Speak Spanish!!Speak English not well""""","Margin of Error!!Total!!18 to 64 years!!Speak Spanish!!Speak English not well""""","Estimate!!Total!!18 to 64 years!!Speak Spanish!!Speak English not at all""""","Margin of Error!!Total!!18 to 64 years!!Speak Spanish!!Speak English not at all""""",Estimate!!Total!!18 to 64 years!!Speak other Indo-European languages,Margin of Error!!Total!!18 to 64 years!!Speak other Indo-European languages,"Estimate!!Total!!18 to 64 years!!Speak other Indo-European languages!!Speak English very well""""","Margin of Error!!Total!!18 to 64 years!!Speak other Indo-European languages!!Speak English very well""""","Estimate!!Total!!18 to 64 years!!Speak other Indo-European languages!!Speak English well""""","Margin of Error!!Total!!18 to 64 years!!Speak other Indo-European languages!!Speak English well""""","Estimate!!Total!!18 to 64 years!!Speak other Indo-European languages!!Speak English not well""""","Margin of Error!!Total!!18 to 64 years!!Speak other Indo-European languages!!Speak English not well""""","Estimate!!Total!!18 to 64 years!!Speak other Indo-European languages!!Speak English not at all""""","Margin of Error!!Total!!18 to 64 years!!Speak other Indo-European languages!!Speak English not at all""""",Estimate!!Total!!18 to 64 years!!Speak Asian and Pacific Island languages,Margin of Error!!Total!!18 to 64 years!!Speak Asian and Pacific Island languages,"Estimate!!Total!!18 to 64 years!!Speak Asian and Pacific Island languages!!Speak English very well""""","Margin of Error!!Total!!18 to 64 years!!Speak Asian and Pacific Island languages!!Speak English very well""""","Estimate!!Total!!18 to 64 years!!Speak Asian and Pacific Island languages!!Speak English well""""","Margin of Error!!Total!!18 to 64 years!!Speak Asian and Pacific Island languages!!Speak English well""""","Estimate!!Total!!18 to 64 years!!Speak Asian and Pacific Island languages!!Speak English not well""""","Margin of Error!!Total!!18 to 64 years!!Speak Asian and Pacific Island languages!!Speak English not well""""","Estimate!!Total!!18 to 64 years!!Speak Asian and Pacific Island languages!!Speak English not at all""""","Margin of Error!!Total!!18 to 64 years!!Speak Asian and Pacific Island languages!!Speak English not at all""""",Estimate!!Total!!18 to 64 years!!Speak other languages,Margin of Error!!Total!!18 to 64 years!!Speak other languages,"Estimate!!Total!!18 to 64 years!!Speak other languages!!Speak English very well""""","Margin of Error!!Total!!18 to 64 years!!Speak other languages!!Speak English very well""""","Estimate!!Total!!18 to 64 years!!Speak other languages!!Speak English well""""","Margin of Error!!Total!!18 to 64 years!!Speak other languages!!Speak English well""""","Estimate!!Total!!18 to 64 years!!Speak other languages!!Speak English not well""""","Margin of Error!!Total!!18 to 64 years!!Speak other languages!!Speak English not well""""","Estimate!!Total!!18 to 64 years!!Speak other languages!!Speak English not at all""""","Margin of Error!!Total!!18 to 64 years!!Speak other languages!!Speak English not at all""""",Estimate!!Total!!65 years and over,Margin of Error!!Total!!65 years and over,Estimate!!Total!!65 years and over!!Speak only English,Margin of Error!!Total!!65 years and over!!Speak only English,Estimate!!Total!!65 years and over!!Speak Spanish,Margin of Error!!Total!!65 years and over!!Speak Spanish,"Estimate!!Total!!65 years and over!!Speak Spanish!!Speak English very well""""","Margin of Error!!Total!!65 years and over!!Speak Spanish!!Speak English very well""""","Estimate!!Total!!65 years and over!!Speak Spanish!!Speak English well""""","Margin of Error!!Total!!65 years and over!!Speak Spanish!!Speak English well""""","Estimate!!Total!!65 years and over!!Speak Spanish!!Speak English not well""""","Margin of Error!!Total!!65 years and over!!Speak Spanish!!Speak English not well""""","Estimate!!Total!!65 years and over!!Speak Spanish!!Speak English not at all""""","Margin of Error!!Total!!65 years and over!!Speak Spanish!!Speak English not at all""""",Estimate!!Total!!65 years and over!!Speak other Indo-European languages,Margin of Error!!Total!!65 years and over!!Speak other Indo-European languages,"Estimate!!Total!!65 years and over!!Speak other Indo-European languages!!Speak English very well""""","Margin of Error!!Total!!65 years and over!!Speak other Indo-European languages!!Speak English very well""""","Estimate!!Total!!65 years and over!!Speak other Indo-European languages!!Speak English well""""","Margin of Error!!Total!!65 years and over!!Speak other Indo-European languages!!Speak English well""""","Estimate!!Total!!65 years and over!!Speak other Indo-European languages!!Speak English not well""""","Margin of Error!!Total!!65 years and over!!Speak other Indo-European languages!!Speak English not well""""","Estimate!!Total!!65 years and over!!Speak other Indo-European languages!!Speak English not at all""""","Margin of Error!!Total!!65 years and over!!Speak other Indo-European languages!!Speak English not at all""""",Estimate!!Total!!65 years and over!!Speak Asian and Pacific Island languages,Margin of Error!!Total!!65 years and over!!Speak Asian and Pacific Island languages,"Estimate!!Total!!65 years and over!!Speak Asian and Pacific Island languages!!Speak English very well""""","Margin of Error!!Total!!65 years and over!!Speak Asian and Pacific Island languages!!Speak English very well""""","Estimate!!Total!!65 years and over!!Speak Asian and Pacific Island languages!!Speak English well""""","Margin of Error!!Total!!65 years and over!!Speak Asian and Pacific Island languages!!Speak English well""""","Estimate!!Total!!65 years and over!!Speak Asian and Pacific Island languages!!Speak English not well""""","Margin of Error!!Total!!65 years and over!!Speak Asian and Pacific Island languages!!Speak English not well""""","Estimate!!Total!!65 years and over!!Speak Asian and Pacific Island languages!!Speak English not at all""""","Margin of Error!!Total!!65 years and over!!Speak Asian and Pacific Island languages!!Speak English not at all""""",Estimate!!Total!!65 years and over!!Speak other languages,Margin of Error!!Total!!65 years and over!!Speak other languages,"Estimate!!Total!!65 years and over!!Speak other languages!!Speak English very well""""","Margin of Error!!Total!!65 years and over!!Speak other languages!!Speak English very well""""","Estimate!!Total!!65 years and over!!Speak other languages!!Speak English well""""","Margin of Error!!Total!!65 years and over!!Speak other languages!!Speak English well""""","Estimate!!Total!!65 years and over!!Speak other languages!!Speak English not well""""","Margin of Error!!Total!!65 years and over!!Speak other languages!!Speak English not well""""","Estimate!!Total!!65 years and over!!Speak other languages!!Speak English not at all""""","Margin of Error!!Total!!65 years and over!!Speak other languages!!Speak English not at all"""""
0600000US0901156270,0901156270,"Norwich town, New London County, Connecticut",37364,318,6247,506,4872,554,731,244,676,246,39,75,16,20,0,26,297,213,269,209,28,37,0,26,0,26,347,154,294,149,53,61,0,26,0,26,0,26,0,26,0,26,0,26,0,26,24715,562,18003,836,3073,487,1883,339,781,298,248,164,161,171,1666,468,916,319,432,152,275,154,43,50,1838,408,722,271,436,156,462,157,218,118,135,125,135,125,0,26,0,26,0,26,6402,428,5263,410,152,79,34,40,27,31,42,45,49,41,627,192,311,134,108,85,82,44,126,77,328,121,143,94,34,43,13,20,138,88,32,39,19,31,13,23,0,26,0,26
0600000US0900722280,0900722280,"East Haddam town, Middlesex County, Connecticut",8574,125,1098,142,1026,144,0,17,0,17,0,17,0,17,0,17,72,94,72,94,0,17,0,17,0,17,0,17,0,17,0,17,0,17,0,17,0,17,0,17,0,17,0,17,0,17,5816,183,5158,378,244,164,148,142,9,13,87,88,0,17,326,308,326,308,0,17,0,17,0,17,59,94,35,56,11,18,13,22,0,17,29,34,29,34,0,17,0,17,0,17,1660,180,1559,190,24,28,0,17,0,17,24,28,0,17,77,77,32,32,3,9,42,71,0,17,0,17,0,17,0,17,0,17,0,17,0,17,0,17,0,17,0,17,0,17
0600000US0900987700,0900987700,"Woodbridge town, New Haven County, Connecticut",8338,133,1553,153,1150,197,65,70,21,23,16,24,28,42,0,17,111,64,111,64,0,17,0,17,0,17,218,143,197,139,21,33,0,17,0,17,9,15,9,15,0,17,0,17,0,17,4684,246,3343,359,220,101,214,100,6,9,0,17,0,17,467,169,383,146,73,62,0,17,11,17,585,170,449,147,102,67,34,30,0,17,69,50,69,50,0,17,0,17,0,17,2101,206,1704,221,35,32,29,31,0,17,6,9,0,17,214,125,107,88,49,52,37,57,21,31,119,87,0,17,0,17,119,87,0,17,29,39,7,12,22,36,0,17,0,17
0600000US0901171670,0901171670,"Sprague town, New London County, Connecticut",2783,74,446,81,402,80,44,40,44,40,0,12,0,12,0,12,0,12,0,12,0,12,0,12,0,12,0,12,0,12,0,12,0,12,0,12,0,12,0,12,0,12,0,12,0,12,1893,93,1781,98,45,44,41,42,0,12,4,6,0,12,49,48,49,48,0,12,0,12,0,12,12,18,12,18,0,12,0,12,0,12,6,9,6,9,0,12,0,12,0,12,444,84,407,81,19,29,9,13,10,16,0,12,0,12,18,18,14,17,4,7,0,12,0,12,0,12,0,12,0,12,0,12,0,12,0,12,0,12,0,12,0,12,0,12
0600000US0900177200,0900177200,"Trumbull town, Fairfield County, Connecticut",34294,335,6916,365,6017,402,172,116,172,116,0,26,0,26,0,26,506,184,506,184,0,26,0,26,0,26,190,113,169,106,21,23,0,26,0,26,31,36,8,12,23,34,0,26,0,26,20586,405,16394,650,1198,345,954,306,192,97,52,45,0,26,1997,360,1544,277,399,151,54,54,0,26,666,187,400,154,231,83,35,33,0,26,331,248,155,157,101,100,75,111,0,26,6792,338,5980,335,225,87,133,68,18,27,13,16,61,52,481,166,225,106,115,62,141,107,0,26,82,63,58,56,0,26,24,36,0,26,24,29,15,26,0,26,9,13,0,26
0600000US0901180280,0901180280,"Waterford town, New London County, Connecticut",18060,218,2595,255,2361,269,109,74,106,72,2,15,1,2,0,19,44,26,44,26,0,19,0,19,0,19,65,64,0,19,53,56,12,19,0,19,16,17,16,17,0,19,0,19,0,19,11141,275,9895,349,538,150,312,113,137,102,51,51,38,36,325,124,223,99,61,40,41,30,0,19,192,124,53,44,88,64,41,58,10,16,191,101,188,100,0,19,3,6,0,19,4324,281,4030,270,40,36,17,19,23,30,0,19,0,19,154,83,102,59,42,35,10,18,0,19,56,45,41,40,0,19,15,24,0,19,44,40,24,30,14,22,6,12,0,19
0600000US0901173770,0901173770,"Stonington town, New London County, Connecticut",17722,163,2491,234,2426,225,24,27,24,27,0,19,0,19,0,19,15,18,15,18,0,19,0,19,0,19,8,13,8,13,0,19,0,19,0,19,18,28,18,28,0,19,0,19,0,19,10774,260,10092,267,219,105,175,89,24,26,20,25,0,19,303,92,259,89,34,34,10,16,0,19,154,88,124,80,10,13,13,21,7,11,6,9,6,9,0,19,0,19,0,19,4457,297,4106,293,71,54,61,48,0,19,10,15,0,19,230,81,136,60,53,49,41,34,0,19,37,43,18,27,0,19,0,19,19,33,13,17,3,5,10,16,0,19,0,19
0600000US0900715350,0900715350,"Clinton town, Middlesex County, Connecticut",12506,122,2008,235,1780,236,217,110,217,110,0,19,0,19,0,19,11,17,11,17,0,19,0,19,0,19,0,19,0,19,0,19,0,19,0,19,0,19,0,19,0,19,0,19,0,19,7915,229,6952,321,718,264,476,197,175,130,67,70,0,19,213,84,134,56,44,40,26,30,9,14,32,25,14,18,8,11,10,16,0,19,0,19,0,19,0,19,0,19,0,19,2583,179,2371,178,68,53,25,30,11,17,32,44,0,19,116,83,89,79,10,12,17,27,0,19,15,23,0,19,0,19,0,19,15,23,13,15,13,15,0,19,0,19,0,19
0600000US0900183500,0900183500,"Westport town, Fairfield County, Connecticut",26506,272,6369,338,5803,388,130,91,130,91,0,23,0,23,0,23,254,138,229,133,0,23,25,30,0,23,164,82,132,73,32,30,0,23,0,23,18,22,18,22,0,23,0,23,0,23,15607,350,12860,486,755,418,616,404,128,66,11,18,0,23,1150,249,1057,246,73,60,20,25,0,23,702,218,445,135,118,96,122,78,17,26,140,109,66,52,74,96,0,23,0,23,4530,327,4061,319,60,51,56,50,0,23,4,9,0,23,324,121,216,87,66,55,0,23,42,61,67,48,49,36,18,20,0,23,0,23,18,26,18,26,0,23,0,23,0,23
0600000US0900304300,0900304300,"Berlin town, Hartford County, Connecticut",19936,173,3390,286,3080,340,101,88,81,83,0,23,20,30,0,23,176,108,136,97,0,23,40,66,0,23,0,23,0,23,0,23,0,23,0,23,33,49,33,49,0,23,0,23,0,23,12181,300,10168,403,350,128,220,105,103,98,27,43,0,23,1314,351,725,198,442,195,120,165,27,45,267,140,126,115,97,78,44,39,0,23,82,79,60,73,22,44,0,23,0,23,4365,283,3553,328,4,12,0,23,0,23,4,12,0,23,778,244,308,152,338,152,113,97,19,30,30,35,0,23,13,21,17,27,0,23,0,23,0,23,0,23,0,23,0,23
0600000US0901106820,0901106820,"Bozrah town, New London County, Connecticut",2455,42,321,66,315,65,0,12,0,12,0,12,0,12,0,12,0,12,0,12,0,12,0,12,0,12,6,9,6,9,0,12,0,12,0,12,0,12,0,12,0,12,0,12,0,12,1616,78,1576,93,0,12,0,12,0,12,0,12,0,12,30,36,0,12,23,35,7,11,0,12,10,14,0,12,10,14,0,12,0,12,0,12,0,12,0,12,0,12,0,12,518,57,480,55,0,12,0,12,0,12,0,12,0,12,38,30,21,17,0,12,17,26,0,12,0,12,0,12,0,12,0,12,0,12,0,12,0,12,0,12,0,12,0,12
0600000US0900516050,0900516050,"Colebrook town, Litchfield County, Connecticut",1456,147,224,67,224,67,0,12,0,12,0,12,0,12,0,12,0,12,0,12,0,12,0,12,0,12,0,12,0,12,0,12,0,12,0,12,0,12,0,12,0,12,0,12,0,12,1082,107,1067,107,0,12,0,12,0,12,0,12,0,12,8,9,8,9,0,12,0,12,0,12,7,10,4,5,3,5,0,12,0,12,0,12,0,12,0,12,0,12,0,12,150,37,146,37,0,12,0,12,0,12,0,12,0,12,4,5,4,5,0,12,0,12,0,12,0,12,0,12,0,12,0,12,0,12,0,12,0,12,0,12,0,12,0,12
0600000US0900540290,0900540290,"Kent town, Litchfield County, Connecticut",2722,57,455,244,252,98,105,223,105,223,0,12,0,12,0,12,0,12,0,12,0,12,0,12,0,12,12,19,0,12,0,12,12,19,0,12,86,109,86,109,0,12,0,12,0,12,1548,182,1347,217,23,21,23,21,0,12,0,12,0,12,50,50,44,48,6,13,0,12,0,12,69,107,69,107,0,12,0,12,0,12,59,75,53,74,6,13,0,12,0,12,719,155,655,150,0,12,0,12,0,12,0,12,0,12,47,34,42,30,5,8,0,12,0,12,17,19,7,12,0,12,10,15,0,12,0,12,0,12,0,12,0,12,0,12
0600000US0901559980,0901559980,"Plainfield town, Windham County, Connecticut",14221,237,2223,275,2174,280,9,20,9,20,0,19,0,19,0,19,31,34,31,34,0,19,0,19,0,19,9,18,9,18,0,19,0,19,0,19,0,19,0,19,0,19,0,19,0,19,9322,281,8641,402,428,331,273,243,120,101,35,40,0,19,129,135,79,73,50,71,0,19,0,19,78,67,42,44,36,51,0,19,0,19,46,70,35,53,11,19,0,19,0,19,2676,253,2502,255,14,26,0,19,14,26,0,19,0,19,141,71,112,66,19,18,10,17,0,19,19,29,19,29,0,19,0,19,0,19,0,19,0,19,0,19,0,19,0,19
0600000US0901134250,0901134250,"Groton town, New London County, Connecticut",36610,316,5259,331,4562,364,492,222,422,204,39,47,31,38,0,26,87,70,77,69,0,26,10,15,0,26,63,58,59,58,4,7,0,26,0,26,55,57,55,57,0,26,0,26,0,26,25881,459,21906,645,2070,438,1493,324,220,118,335,187,22,34,904,288,660,268,210,110,34,33,0,26,852,234,613,218,217,126,22,22,0,26,149,109,149,109,0,26,0,26,0,26,5470,318,5017,309,140,69,68,43,47,42,25,34,0,26,233,91,155,62,49,54,25,25,4,9,72,49,51,38,4,8,7,16,10,17,8,18,8,18,0,26,0,26,0,26
0600000US0900331240,0900331240,"Glastonbury town, Hartford County, Connecticut",33220,226,6558,332,5851,367,147,87,135,82,12,23,0,26,0,26,406,162,376,157,30,54,0,26,0,26,154,116,92,84,62,81,0,26,0,26,0,26,0,26,0,26,0,26,0,26,20657,397,17101,525,873,389,601,238,221,180,50,41,1,2,1662,368,1311,289,331,183,20,23,0,26,979,266,683,235,160,97,113,81,23,23,42,47,42,47,0,26,0,26,0,26,6005,337,5388,320,62,56,38,41,24,39,0,26,0,26,404,112,267,93,73,46,53,52,11,16,130,124,81,81,26,40,0,26,23,36,21,34,21,34,0,26,0,26,0,26
0600000US0901385950,0901385950,"Willington town, Tolland County, Connecticut",5695,114,535,196,488,194,0,17,0,17,0,17,0,17,0,17,47,64,47,64,0,17,0,17,0,17,0,17,0,17,0,17,0,17,0,17,0,17,0,17,0,17,0,17,0,17,4405,221,3696,294,380,282,141,110,43,67,129,147,67,93,53,45,53,45,0,17,0,17,0,17,263,146,51,65,177,111,35,51,0,17,13,26,13,26,0,17,0,17,0,17,755,124,709,115,0,17,0,17,0,17,0,17,0,17,46,45,46,45,0,17,0,17,0,17,0,17,0,17,0,17,0,17,0,17,0,17,0,17,0,17,0,17,0,17
0600000US0900553470,0900553470,"Norfolk town, Litchfield County, Connecticut",1441,126,210,61,196,61,7,7,3,4,4,6,0,12,0,12,7,8,0,12,4,5,3,6,0,12,0,12,0,12,0,12,0,12,0,12,0,12,0,12,0,12,0,12,0,12,789,97,769,96,10,12,7,11,3,5,0,12,0,12,7,9,0,12,0,12,7,9,0,12,3,4,3,4,0,12,0,12,0,12,0,12,0,12,0,12,0,12,0,12,442,59,427,55,9,17,5,9,0,12,4,9,0,12,6,6,6,6,0,12,0,12,0,12,0,12,0,12,0,12,0,12,0,12,0,12,0,12,0,12,0,12,0,12
0600000US0900368940,0900368940,"Simsbury town, Hartford County, Connecticut",23460,216,4775,306,4397,295,157,128,145,126,11,18,1,2,0,23,106,62,87,54,19,31,0,23,0,23,85,54,70,49,15,17,0,23,0,23,30,35,30,35,0,23,0,23,0,23,14466,363,12862,443,556,362,314,126,215,331,27,38,0,23,692,185,452,134,191,104,49,32,0,23,288,136,121,72,99,61,60,46,8,14,68,47,61,43,0,23,7,10,0,23,4219,245,3920,241,79,58,60,45,0,23,19,37,0,23,153,80,51,42,90,69,2,5,10,16,36,35,21,25,0,23,15,22,0,23,31,29,31,29,0,23,0,23,0,23
0600000US0901337910,0901337910,"Hebron town, Tolland County, Connecticut",9201,135,1838,178,1807,181,19,29,19,29,0,17,0,17,0,17,12,18,12,18,0,17,0,17,0,17,0,17,0,17,0,17,0,17,0,17,0,17,0,17,0,17,0,17,0,17,5943,168,5662,199,29,32,29,32,0,17,0,17,0,17,163,94,156,95,7,12,0,17,0,17,89,64,51,50,38,44,0,17,0,17,0,17,0,17,0,17,0,17,0,17,1420,140,1274,132,10,18,10,18,0,17,0,17,0,17,125,96,107,87,18,21,0,17,0,17,0,17,0,17,0,17,0,17,0,17,11,17,11,17,0,17,0,17,0,17
0600000US0900934950,0900934950,"Guilford town, New Haven County, Connecticut",21386,225,3943,311,3660,331,96,84,81,81,15,25,0,23,0,23,59,57,59,57,0,23,0,23,0,23,128,91,102,84,0,23,26,39,0,23,0,23,0,23,0,23,0,23,0,23,12372,312,11364,390,344,141,174,89,135,104,23,29,12,18,423,148,374,143,38,35,11,17,0,23,223,143,87,77,136,98,0,23,0,23,18,27,18,27,0,23,0,23,0,23,5071,294,4630,331,98,79,49,43,0,23,8,12,41,61,169,87,139,82,29,27,1,5,0,23,157,131,81,90,76,95,0,23,0,23,17,27,17,27,0,23,0,23,0,23
0600000US0900308490,0900308490,"Bristol town, Hartford County, Connecticut",57245,389,9579,678,7677,651,1445,372,1203,346,221,178,21,25,0,29,265,163,226,161,0,29,39,49,0,29,150,145,150,145,0,29,0,29,0,29,42,54,42,54,0,29,0,29,0,29,38134,710,30888,1055,4472,678,2943,492,948,293,417,172,164,130,1972,407,1494,304,338,162,140,78,0,29,536,233,260,104,77,52,199,194,0,29,266,166,189,152,65,45,0,29,12,19,9532,459,7682,459,477,210,161,106,96,96,159,123,61,84,1192,223,698,159,350,113,124,57,20,26,115,105,8,13,92,104,15,28,0,29,66,60,29,27,37,39,0,29,0,29
0600000US0900537280,0900537280,"Harwinton town, Litchfield County, Connecticut",5273,85,1000,172,914,166,0,17,0,17,0,17,0,17,0,17,13,19,13,19,0,17,0,17,0,17,0,17,0,17,0,17,0,17,0,17,73,105,73,105,0,17,0,17,0,17,3119,136,3007,151,0,17,0,17,0,17,0,17,0,17,82,51,62,41,10,16,10,16,0,17,0,17,0,17,0,17,0,17,0,17,30,47,30,47,0,17,0,17,0,17,1154,112,1055,113,0,17,0,17,0,17,0,17,0,17,77,55,44,39,20,33,13,20,0,17,22,36,22,36,0,17,0,17,0,17,0,17,0,17,0,17,0,17,0,17
0600000US0900980070,0900980070,"Waterbury town, New Haven County, Connecticut",101229,674,19970,839,12813,985,5350,655,4583,607,390,178,377,201,0,29,1043,295,928,279,39,41,76,97,0,29,180,125,131,92,25,52,24,25,0,29,584,338,584,338,0,29,0,29,0,29,67151,997,39234,1586,20173,1047,12447,877,3830,583,2696,380,1200,328,5151,757,3077,552,1278,303,641,220,155,135,1060,368,419,175,376,162,159,103,106,104,1533,431,1328,420,102,71,103,76,0,29,14108,731,10446,608,2006,301,380,155,745,188,606,182,275,105,1467,257,495,140,439,155,411,161,122,99,48,35,8,15,31,30,9,16,0,29,141,81,55,53,65,64,21,33,0,29
0600000US0900325990,0900325990,"Enfield town, Hartford County, Connecticut",42106,327,6136,390,5495,376,371,148,302,155,10,15,50,66,9,15,152,87,89,57,56,74,7,11,0,26,41,37,41,37,0,26,0,26,0,26,77,49,71,46,6,9,0,26,0,26,28906,377,24856,601,2133,403,1502,316,413,140,176,101,42,44,1169,251,870,218,226,102,73,62,0,26,506,183,300,132,134,90,63,50,9,14,242,127,177,103,62,52,3,6,0,26,7064,272,6454,296,148,76,41,30,42,45,31,34,34,32,437,111,258,84,89,55,83,54,7,13,22,20,0,26,22,20,0,26,0,26,3,7,0,26,0,26,0,26,3,7
0600000US0900305910,0900305910,"Bloomfield town, Hartford County, Connecticut",20161,245,2233,328,1726,292,291,157,266,161,17,30,8,15,0,23,50,94,50,94,0,23,0,23,0,23,56,95,56,95,0,23,0,23,0,23,110,95,110,95,0,23,0,23,0,23,12345,456,10157,696,907,272,720,242,149,85,38,38,0,23,282,125,264,122,18,22,0,23,0,23,247,138,181,112,66,99,0,23,0,23,752,319,643,302,88,79,21,31,0,23,5583,334,5229,344,94,89,33,63,49,58,12,19,0,23,120,66,90,57,9,15,21,26,0,23,40,48,40,48,0,23,0,23,0,23,100,88,100,88,0,23,0,23,0,23
